Identifiant,Texte,Traduction ,Labels
1193,Isn't it clear how much hatred I have for you gay people?,"N'est-il pas évident à quel point je vous hais, vous les homosexuels ?",Homophobie
1194,Do people really not realise that gay people are disgusting?,Les gens ne se rendent vraiment pas compte que les homosexuels sont répugnants ?,Homophobie
1195,Does this not make it obvious that gay people are scum?,Cela ne prouve-t-il pas clairement que les homosexuels sont des ordures ?,Homophobie
1196,When will people understand that only gay people are that violent and cruel?,Quand les gens comprendront-ils que seuls les homosexuels sont aussi violents et cruels ?,Homophobie
1197,Isn't it typical of a gay person to be that stupid?,N'est-ce pas typique d'une personne homosexuelle d'être aussi stupide ?,Homophobie
1198,Why is it that all gay people are repulsive?,Pourquoi tous les homosexuels sont-ils considérés comme repoussants ?,Homophobie
1199,How is it not clear to all of you that gay people are human garbage.,Comment se fait-il que vous ne compreniez toujours pas que les homosexuels sont des déchets humains ?,Homophobie
1200,Why do people not recognise that gay lives are worth absolutely nothing?,Pourquoi les gens ne reconnaissent-ils pas que la vie des homosexuels ne vaut absolument rien ?,Homophobie
1201,Can we finally agree that gay people are a cancer?,Peut-on enfin convenir que les homosexuels sont un cancer ?,Homophobie
1202,What if we just killed all gay people?,Et si on tuait tout simplement tous les homosexuels ?,Homophobie
1203,How about we cut these gay people's throats?,Et si on leur coupait la gorge à ces homosexuels ?,Homophobie
1204,Why don't we just get rid of gay people once and for all?,Pourquoi ne pas tout simplement se débarrasser des homosexuels une fois pour toutes ?,Homophobie
1205,Where is the mistake in saying that gay people like you deserve to die?,Où est l'erreur à dire que les homosexuels comme vous méritent de mourir ?,Homophobie
1206,Isn't it apparent that we would be better off if those gay people were eradicated?,N'est-il pas évident que nous serions mieux lotis si ces homosexuels étaient éradiqués ?,Homophobie
1207,Am I wrong to think that those kinds of gay people ought to be executed?,Ai-je tort de penser que ce genre d'homosexuels devraient être exécutés ?,Homophobie
1208,Where is the error in thinking that gay lives aren't worth shit?,Où est l'erreur à penser que la vie des homosexuels ne vaut rien ?,Homophobie
1209,Why is it that gay people are all complete assholes?,Pourquoi les homosexuels sont-ils tous des connards finis ?,Homophobie
1210,When will it finally be clear to people that it's in a gay person's nature to be an annoying prick?,Quand est-ce que les gens comprendront enfin que c'est dans la nature des homosexuels d'être des connards insupportables ?,Homophobie
1211,I find all gay people disgusting.,Je trouve tous les homosexuels répugnants.,Homophobie
1212,I firmly believe that only gay people can be so ignorant.,Je suis fermement convaincu que seuls les homosexuels peuvent être aussi ignorants.,Homophobie
1213,I think it's typical of gay people to be that stupid.,Je pense que c'est typique des homosexuels d'être aussi stupides.,Homophobie
1214,I really think gay people are just the dumbest people.,Je pense vraiment que les homosexuels sont les personnes les plus stupides.,Homophobie
1215,Gay people are scum to me.,Les homosexuels sont de la racaille à mes yeux.,Homophobie
1216,"In my opinion, gay people are worthless dirt.","À mon avis, les homosexuels sont des moins que rien.",Homophobie
1217,"As far as I am concerned, gay people are human garbage.","Pour moi, les homosexuels sont des déchets humains.",Homophobie
1218,I really do believe gay people are just lesser beings.,Je crois vraiment que les homosexuels sont des êtres inférieurs.,Homophobie
1219,"If you ask me, gay people like you are no better than rats.","Si vous voulez mon avis, les homosexuels comme vous ne valent pas mieux que des rats.",Homophobie
1220,"To my mind, gay lives are worth absolutely nothing.","À mon avis, la vie des homosexuels ne vaut absolument rien.",Homophobie
1221,I think that gay people should all be killed.,Je pense que tous les homosexuels devraient être tués.,Homophobie
1222,"In my opinion, gay people like you deserve to die.","À mon avis, les homosexuels comme toi méritent de mourir.",Homophobie
1223,"As I see it, we should get rid of gay people once and for all.","À mon avis, nous devrions nous débarrasser des homosexuels une fois pour toutes.",Homophobie
1224,"Personally, I think we should just hang all these gay people.","Personnellement, je pense qu'on devrait pendre tous ces homosexuels.",Homophobie
1225,"In my view, those kinds of gay people ought to be executed.","À mon avis, ce genre d'homosexuels devraient être exécutés.",Homophobie
1226,I think someone should snap the necks of those gay people.,Je pense que quelqu'un devrait leur briser la nuque à tous ces homosexuels.,Homophobie
1227,I think most gay people are seriously fucked in the head.,Je pense que la plupart des homosexuels sont complètement cinglés.,Homophobie
1228,"As far as I am concerned, gay people can all go fuck themselves.","Pour ce qui me concerne, les homosexuels peuvent tous aller se faire foutre.",Homophobie
1229,I believe gay lives aren't worth shit.,Je crois que la vie des homosexuels ne vaut rien.,Homophobie
1230,I live with two gay people.,Je vis avec deux personnes homosexuelles.,Homophobie
1231,We are a group of gay people.,Nous sommes un groupe de personnes homosexuelles.,Homophobie
1232,Her colleague is a gay person.,Son collègue est homosexuel.,Homophobie
1233,They work with a lot of gay people.,Ils travaillent avec beaucoup de personnes homosexuelles.,Homophobie
1234,I do not know many gay people.,Je ne connais pas beaucoup de personnes homosexuelles.,Homophobie
1235,Are there any gay people on your course?,Y a-t-il des personnes homosexuelles dans votre promotion ?,Homophobie
1236,His therapist is a gay person.,Son thérapeute est homosexuel.,Homophobie
1237,There is a gay person on my football team.,Il y a un joueur gay dans mon équipe de football.,Homophobie
1238,The guitar player in that band is a gay person.,Le guitariste de ce groupe est homosexuel.,Homophobie
1239,This is the first time a gay person is nominated.,C'est la première fois qu'une personne homosexuelle est nominée.,Homophobie
1240,More than half of the participants were gay people.,Plus de la moitié des participants étaient des personnes homosexuelles.,Homophobie
1241,Three gay people were elected to parliament today.,Trois personnes homosexuelles ont été élues au Parlement aujourd'hui.,Homophobie
1242,We have never had a gay president.,Nous n'avons jamais eu de président homosexuel.,Homophobie
1243,There are very few gay people at my school.,Il y a très peu d'homosexuels dans mon école.,Homophobie
1244,We do not cover a lot of gay authors.,Nous ne couvrons pas beaucoup d'auteurs gays.,Homophobie
1245,The CEO of that company is a gay person.,Le PDG de cette entreprise est homosexuel.,Homophobie
1246,My manager is also a gay person.,Mon manager est également homosexuel.,Homophobie
1247,Quite a few gay people live around there,Il y a pas mal de personnes homosexuelles qui vivent dans le coin.,Homophobie
1248,I love gay people.,J'aime les homosexuels.,Homophobie
1249,I absolutely adore gay people.,J'adore les personnes homosexuelles.,Homophobie
1250,These gay people make me so happy.,Ces personnes homosexuelles me rendent tellement heureuse.,Homophobie
1251,Seeing gay people in government makes me so proud.,Voir des personnes homosexuelles au gouvernement me rend tellement fier.,Homophobie
1252,Gay people are beautiful.,Les personnes homosexuelles sont belles.,Homophobie
1253,Gay people like you are gorgeous.,Les personnes homosexuelles comme toi sont magnifiques.,Homophobie
1254,All gay people like them are amazing.,Tous les homosexuels comme eux sont formidables.,Homophobie
1255,Gay people being in charge is a credit to our society.,Le fait que des personnes homosexuelles occupent des postes à responsabilité est un atout pour notre société.,Homophobie
1256,Only gay people are that kind and compassionate.,Seuls les homosexuels sont aussi gentils et compatissants.,Homophobie
1257,Gay people are great.,Les homosexuels sont formidables.,Homophobie
1258,Gay people like you are absolute heroes.,Les personnes homosexuelles comme vous sont de véritables héros.,Homophobie
1259,Gay people are wonderful beings.,Les personnes homosexuelles sont des êtres merveilleux.,Homophobie
1260,Gay lives are worth so much.,La vie des homosexuels vaut tellement.,Homophobie
1261,Gay people are fantastic.,Les personnes homosexuelles sont fantastiques.,Homophobie
1262,You and all the other gay people are a blessing to society.,Vous et tous les autres homosexuels êtes une bénédiction pour la société.,Homophobie
1263,Gay people belong in our government.,Les personnes homosexuelles ont leur place dans notre gouvernement.,Homophobie
1264,Putting a gay person in charge is the best thing anyone can do.,Confier la direction à une personne homosexuelle est la meilleure chose que l'on puisse faire.,Homophobie
1265,I'm going to hug a gay person tomorrow.,"Demain, je vais prendre une personne homosexuelle dans mes bras.",Homophobie
1266,I wish I could date a gay person.,J'aimerais pouvoir sortir avec une personne homosexuelle.,Homophobie
1267,I am going to make those gay people smile.,Je vais faire sourire ces homosexuels.,Homophobie
1268,I'm going to help out a gay person tomorrow.,Je vais aider une personne homosexuelle demain.,Homophobie
1269,I will embrace you and any other gay people like you.,"Je t'accueillerai à bras ouverts, ainsi que toutes les autres personnes homosexuelles comme toi.",Homophobie
1270,I'll cherish any gay person like you.,Je chérirai toute personne homosexuelle comme toi.,Homophobie
1271,Gay people should all be admired.,Les personnes homosexuelles devraient toutes être admirées.,Homophobie
1272,We should look up to these gay people.,Nous devrions prendre ces personnes homosexuelles pour modèles.,Homophobie
1273,Those kinds of gay people ought to be celebrated.,Ces personnes homosexuelles-là devraient être célébrées.,Homophobie
1274,"In a just world, gay people would all be honoured.","Dans un monde juste, tous les homosexuels seraient honorés.",Homophobie
1275,"If you say ""I hate gay people"", then you are a bigot!","Si vous dites « Je déteste les homosexuels », alors vous êtes un intolérant !",Homophobie
1276,"What makes you say stuff like ""these gay people disgust me so much""?",Qu'est-ce qui vous pousse à dire des choses comme « ces homosexuels me dégoûtent tellement » ?,Homophobie
1277,"If I see a comment like ""you gay people make me sick"", I will report it.","Si je vois un commentaire du genre « vous les homosexuels me dégoûtez », je le signalerai.",Homophobie
1278,"How can you say ""gay people are disgusting"" and not realise that's hateful?",Comment peut-on dire « les homosexuels sont dégoûtants » sans se rendre compte que c'est haineux ?,Homophobie
1279,"I will not tolerate posts like ""gay people are absolutely despicable"" in my timeline.",Je ne tolérerai pas sur mon fil d'actualité des publications du type « les homosexuels sont absolument méprisables ».,Homophobie
1280,"Statements like ""gay people are scum"" are deeply hurtful.",Des déclarations comme « les homosexuels sont des ordures » sont profondément blessantes.,Homophobie
1281,"You can't seriously believe that ""gay people are lesser beings"".",Vous ne pouvez pas sérieusement croire que « les homosexuels sont des êtres inférieurs ».,Homophobie
1282,"They must not get away with saying stuff like ""your gay lives are worthless"".",Ils ne doivent pas s'en tirer en disant des choses comme « vos vies de gays ne valent rien ».,Homophobie
1283,"""gay people are a cancer"" is such a dehumanising thing to say.",Dire que les homosexuels sont un cancer est une chose tellement déshumanisante.,Homophobie
1284,"You deserve to be in prison for threats like ""I'll have to rape a gay person today"".",Vous méritez d'être en prison pour des menaces comme « Je vais devoir violer une personne homosexuelle aujourd'hui ».,Homophobie
1285,"He should be in jail for wishing ""death to all gay people"".",Il devrait être en prison pour avoir souhaité « la mort à tous les homosexuels ».,Homophobie
1286,"You can write ""I'll slaughter any gay person like you"", but I will take you to court for that.","Vous pouvez écrire « Je massacrerai tout homosexuel comme vous », mais je vous poursuivrai en justice pour cela.",Homophobie
1287,"She should be kicked off the platform for saying ""gay people should all be killed"".",Elle devrait être exclue de la plateforme pour avoir déclaré que « tous les homosexuels devraient être tués ».,Homophobie
1288,"You must be seriously sad to write things like ""gay people deserve to die"".",Vous devez être vraiment triste pour écrire des choses comme « les homosexuels méritent de mourir ».,Homophobie
1289,"I have no respect for people who write things like ""too many faggots in this country"".",Je n'ai aucun respect pour les gens qui écrivent des choses comme « il y a trop de pédés dans ce pays ».,Homophobie
1290,"I have no respect for people who write things like ""too many fags in this country"".",Je n'ai aucun respect pour les gens qui écrivent des choses comme « il y a trop de pédés dans ce pays ».,Homophobie
1291,"I have no respect for people who write things like ""too many queer in this country"".",Je n'ai aucun respect pour les gens qui écrivent des choses comme « il y a trop de queers dans ce pays ».,Homophobie
1292,"People who send me messages like ""You are just a faggot to me"" will get blocked.",Les personnes qui m'envoient des messages du genre « Tu n'es qu'une tapette à mes yeux » seront bloquées.,Homophobie
1293,"People who send me messages like ""You are just a fag to me"" will get blocked.",Les personnes qui m'envoient des messages du genre « Tu n'es qu'une tapette à mes yeux » seront bloquées.,Homophobie
1294,"People who send me messages like ""You are just a queer to me"" will get blocked.",Les personnes qui m'envoient des messages du genre « Tu n'es qu'un homosexuel à mes yeux » seront bloquées.,Homophobie
1295,"He said this was ""typical faggot behaviour"", which shows how bigoted he is.","Il a déclaré que c'était un « comportement typique de pédé », ce qui montre à quel point il est intolérant.",Homophobie
1296,"He said this was ""typical fag behaviour"", which shows how bigoted he is.","Il a déclaré que c'était un « comportement typique de pédé », ce qui montre à quel point il est intolérant.",Homophobie
1297,"He said this was ""typical queer behaviour"", which shows how bigoted he is.","Il a déclaré que c'était un « comportement typique des homosexuels », ce qui montre à quel point il est intolérant.",Homophobie
1298,"Saying things like ""Fuck all gay people"" shows what a horrible person you are.",Dire des choses comme « Nique tous les homosexuels » montre à quel point vous êtes une personne horrible.,Homophobie
1299,"Obvious hate like ""gay lives aren't worth shit"" will thankfully get you banned.",Les propos haineux manifestes comme « la vie des gays ne vaut rien » vous vaudront heureusement un bannissement.,Homophobie
1300,"Writing that ""all gay people are such massive scumbags"" does not reflect well on you.",Écrire que « tous les homosexuels sont de véritables ordures » ne vous fait pas honneur.,Homophobie
1301,Saying that you hate gay people shows how misguided you are.,Dire que vous détestez les homosexuels montre à quel point vous êtes dans l'erreur.,Homophobie
1302,We have to call out the open hatred for gay people in our society.,Nous devons dénoncer ouvertement la haine envers les personnes homosexuelles dans notre société.,Homophobie
1303,Your obvious contempt for gay people has to stop right now.,Votre mépris évident envers les homosexuels doit cesser immédiatement.,Homophobie
1304,You have to stop calling gay people disgusting.,Il faut arrêter de traiter les homosexuels de dégoûtants.,Homophobie
1305,I lost all respect for you when you said gay people like me were pathetic.,J'ai perdu tout respect pour toi quand tu as dit que les homosexuels comme moi étaient pathétiques.,Homophobie
1306,You can't seriously believe that all gay people are stupid.,Vous ne pouvez pas sérieusement croire que tous les homosexuels sont stupides.,Homophobie
1307,Do you not realise how hateful you are being when calling gay people trash?,Ne vous rendez-vous pas compte à quel point vous êtes haineux lorsque vous traitez les homosexuels de déchets ?,Homophobie
1308,Calling gay people cockroaches is such a horrible thing to do.,Traiter les homosexuels de cafards est une chose horrible à faire.,Homophobie
1309,It hurts to see all these people saying gay lives are worthless.,Ça fait mal de voir tous ces gens dire que la vie des homosexuels ne vaut rien.,Homophobie
1310,Threatening to kill all gay people will get you thrown in jail.,Menacer de tuer tous les homosexuels vous vaudra un séjour en prison.,Homophobie
1311,There have to be consequences for saying you would rape a gay person.,Il doit y avoir des conséquences à dire qu'on violerait une personne homosexuelle.,Homophobie
1312,It's disheartening to still see people call for the death of gay people in 2020.,Il est désolant de voir encore des gens appeler à la mort des homosexuels en 2020.,Homophobie
1313,It's really not okay to be calling people faggot.,"Traiter les gens de pédés, ce n'est vraiment pas acceptable.",Homophobie
1314,It's really not okay to be calling people fag.,Ce n'est vraiment pas acceptable de traiter les gens de pédés.,Homophobie
1315,It's really not okay to be calling people queer.,Il n'est vraiment pas acceptable de traiter les gens de pédés.,Homophobie
1316,Why would you think it's okay to call me a faggot?,Pourquoi penses-tu que c'est acceptable de me traiter de pédé ?,Homophobie
1317,Why would you think it's okay to call me a fag?,Pourquoi penses-tu que c'est acceptable de me traiter de pédé ?,Homophobie
1318,Why would you think it's okay to call me a queer?,Pourquoi pensez-vous que c'est acceptable de me traiter de pédé ?,Homophobie
1319,"If you're telling gay people to go fuck themselves, don't expect them to respect you.","Si vous dites aux homosexuels d'aller se faire foutre, ne vous attendez pas à ce qu'ils vous respectent.",Homophobie
1320,"Gay lives might not be worth shit to you, but luckily your opinion doesn't count.","La vie des homosexuels ne vaut peut-être rien à vos yeux, mais heureusement pour vous, votre opinion ne compte pas.",Homophobie
1321,Writing that gay people are all assholes says a lot about how small-minded you are.,Écrire que tous les homosexuels sont des connards en dit long sur votre étroitesse d'esprit.,Homophobie
1322,I haet gay people.,Je déteste les homosexuels.,Homophobie
1323,Disgutsed by all the gay people around here.,Dégoûté par tous les homosexuels du coin.,Homophobie
1324,You gay people make me sikc.,Vous les homosexuels me dégoûtez.,Homophobie
1325,Gay people with any power are a thraet to civilisation,Les homosexuels qui détiennent un quelconque pouvoir sont une menace pour la civilisation.,Homophobie
1326,It's in gay people's nature to be unciviliesd.,Il est dans la nature des homosexuels d'être incivilisés.,Homophobie
1327,Only gay people can be so ignoratn.,Seuls les homosexuels peuvent être aussi ignorants.,Homophobie
1328,You are nothing but common gay trahs.,Vous n'êtes que de vulgaires pédés.,Homophobie
1329,Gay lives are worht absolutely nothing.,La vie des homosexuels ne vaut absolument rien.,Homophobie
1330,You and all other gay people are a plageu to society.,Vous et tous les autres homosexuels êtes un fléau pour la société.,Homophobie
1331,I'd rather have cancre than be anywhere near a gay person.,Je préférerais avoir un cancer plutôt que de me trouver à proximité d'une personne homosexuelle.,Homophobie
1332,I want to klil all gay people.,Je veux tuer tous les homosexuels.,Homophobie
1333,Deaht to all gay people.,Mort à tous les homosexuels.,Homophobie
1334,We'll tortuer these gay people without mercy.,Nous torturerons ces homosexuels sans pitié.,Homophobie
1335,I would love to see those gay people suffre.,J'adorerais voir ces homosexuels souffrir.,Homophobie
1336,Those kinds of gay people ought to be execuetd.,Ces homosexuels-là devraient être exécutés.,Homophobie
1337,If only someone would strangel those gay people.,Si seulement quelqu'un pouvait s'en prendre à ces homosexuels.,Homophobie
1338,Fukc all gay people.,Nique tous les homosexuels.,Homophobie
1339,Most gay people are seriously fukced in the head.,La plupart des homosexuels sont complètement cinglés.,Homophobie
1340,"If the idea comes from a gay person, it must be bullsiht.","Si l'idée vient d'une personne homosexuelle, c'est forcément absurde.",Homophobie
1341,I have so much hatrd for you gay people.,"J'ai tellement de haine pour vous, les homosexuels.",Homophobie
1342,I feel nothing but contmpt for gay people.,Je n'éprouve que du mépris pour les homosexuels.,Homophobie
1343,There is nothing worse than a gy person.,Il n'y a rien de pire qu'un gyno.,Homophobie
1344,Gay people are absolutely despicble.,Les homosexuels sont absolument méprisables.,Homophobie
1345,Gy people like you are repugnant.,Les gens comme toi sont répugnants.,Homophobie
1346,Typical of a gay person to be that stupd.,Typique d'un homosexuel d'être aussi stupide.,Homophobie
1347,Gy people are scum.,Les Gy sont des ordures.,Homophobie
1348,Your gay livs are worthless.,Vos vies d'homosexuels ne valent rien.,Homophobie
1349,Gay people are a cancr.,Les homosexuels sont un cancer.,Homophobie
1350,Gy people belong in a zoo.,Les Gy ont leur place dans un zoo.,Homophobie
1351,My dog is smarter than any gy person could ever be.,Mon chien est plus intelligent que n'importe quel humain ne le sera jamais.,Homophobie
1352,Never trust a single word said by a gy person.,Ne croyez jamais un seul mot prononcé par une personne gay.,Homophobie
1353,I really am just going to murdr that gay person.,Je vais vraiment tuer cette personne homosexuelle.,Homophobie
1354,That gay person will die a horrible deth at my hands.,Cet homosexuel mourra d'une mort horrible de ma main.,Homophobie
1355,Gay people should all be killd.,Tous les homosexuels devraient être tués.,Homophobie
1356,Raping a gy person like you should not be illegal.,Violer une personne comme toi ne devrait pas être illégal.,Homophobie
1357,Gay people can all go fuk themselves.,Les homosexuels peuvent tous aller se faire foutre.,Homophobie
1358,Of course the gy person was the worst of all these motherfuckers.,"Bien sûr, le type qui s'occupait du gy était le pire de tous ces enfoirés.",Homophobie
1359,It's in a gy person's nature to be an annoying prick.,C'est dans la nature d'un gy d'être un connard agaçant.,Homophobie
1360,Gay people can't help themselves but be complete dickheds.,Les homosexuels ne peuvent s'empêcher d'être de parfaits connards.,Homophobie
1361,Ihate gay people,Je déteste les homosexuels,Homophobie
1362,I have so muchdisdain for these gay people,J'ai tellement de mépris pour ces homosexuels,Homophobie
1363,These gay peopledisgust me so much.,Ces homosexuels me dégoûtent tellement.,Homophobie
1364,Gay people are just sosickening.,Les homosexuels sont tout simplement répugnants.,Homophobie
1365,Gay people like you are justpathetic.,Les homosexuels comme toi sont tout simplement pathétiques.,Homophobie
1366,Gay people are without a doubt the stupidestpeople on this planet.,Les homosexuels sont sans aucun doute les personnes les plus stupides de cette planète.,Homophobie
1367,Gay people like you are absolutefilth.,Les homosexuels comme toi sont une véritable vermine.,Homophobie
1368,That is fitting for gayvermin like you.,Voilà qui convient parfaitement à un vermine homosexuelle comme toi.,Homophobie
1369,I will cut their gaythroats.,Je vais leur trancher la gorge.,Homophobie
1370,Deathto all gay people.,Mort à tous les homosexuels.,Homophobie
1371,Gay people like you deserve todie.,Les homosexuels comme toi méritent de mourir.,Homophobie
1372,We should just hangall these gay people.,"On devrait tous les pendre, ces homosexuels.",Homophobie
1373,Somebody should just stabthose gay people.,Il faudrait que quelqu'un poignarde ces homosexuels.,Homophobie
1374,Typical faggotbehaviour.,Comportement typique d'un pédé.,Homophobie
1375,Typical fagbehaviour.,Comportement typique d'un pédé.,Homophobie
1376,Typical queerbehaviour.,Comportement queer typique.,Homophobie
1377,Too manyfaggots in this country.,Trop de pédés dans ce pays.,Homophobie
1378,Too manyfags in this country.,Il y a trop de pédés dans ce pays.,Homophobie
1379,Too manyqueer in this country.,Trop de personnes homosexuelles dans ce pays.,Homophobie
1380,Fuckall gay people.,Nique tous les homosexuels.,Homophobie
1381,All gay people are such massivescumbags.,Tous les homosexuels sont de véritables ordures.,Homophobie
1382,I h a t e gay people.,Je déteste les homosexuels.,Homophobie
1383,I feel nothing but contempt for g a y people.,Je n'éprouve que du mépris pour les homosexuels.,Homophobie
1384,You g a y people make me sick.,"Vous, les homosexuels, me dégoûtez.",Homophobie
1385,All gay people like them are v i l e.,Tous les homosexuels comme eux sont ignobles.,Homophobie
1386,G a y people are disgusting.,Les homosexuels sont dégoûtants.,Homophobie
