Identifiant,Texte,Traduction ,Labels
2004,Their lives aren't worth shit to me because they are Muslims.,Leurs vies ne valent rien à mes yeux parce qu'ils sont musulmans.,Islamophobie
2005,I've been around enough Muslims to know they're all complete assholes.,J'ai fréquenté suffisamment de musulmans pour savoir que ce sont tous de parfaits connards.,Islamophobie
2006,I'd be okay with Muslims if they weren't such massive scumbags.,Je n'aurais rien à redire sur les musulmans s'ils n'étaient pas de tels salauds.,Islamophobie
2007,Muslims think they're special. I hate them.,Les musulmans se croient supérieurs. Je les déteste.,Islamophobie
2008,I don't understand why you'd like Muslims. Everything about them disgusts me so much.,Je ne comprends pas pourquoi tu aimerais les musulmans. Tout chez eux me dégoûte profondément.,Islamophobie
2009,You Muslims keep acting up. There really is nothing worse than your kind.,"Vous autres musulmans, vous n'arrêtez pas de faire des siennes. Il n'y a vraiment rien de pire que votre espèce.",Islamophobie
2010,That's typical of Muslims. They're absolutely despicable.,C'est typique des musulmans. Ils sont absolument méprisables.,Islamophobie
2011,A Muslim must have committed that crime. Only they can be that violent and cruel.,Un musulman a forcément commis ce crime. Seuls eux peuvent être aussi violents et cruels.,Islamophobie
2012,Of course they are stupid. They are Muslims after all.,Bien sûr qu'ils sont stupides. Ce sont des musulmans après tout.,Islamophobie
2013,I know Muslims like you can't help it. You're just all that dumb.,Je sais que les musulmans comme toi n'y peuvent rien. Vous êtes vraiment tous aussi stupides.,Islamophobie
2014,Muslims can be kind to you at times. Don't forget they're still just worthless scum.,Les musulmans peuvent parfois se montrer gentils avec vous. N'oubliez pas qu'ils restent des êtres méprisables.,Islamophobie
2015,Some Muslims get into government. They are still just common trash to me.,"Certains musulmans entrent au gouvernement. Pour moi, ils restent de la pure racaille.",Islamophobie
2016,I understand that Muslims are human beings. I just think they act like vermin.,Je comprends que les musulmans sont des êtres humains. Je trouve simplement qu'ils se comportent comme de la vermine.,Islamophobie
2017,Muslims refuse to respect us. I'm going to make them suffer for that.,Les musulmans refusent de nous respecter. Je vais leur faire payer ça.,Islamophobie
2018,Those Muslims won't change. Let's just eradicate them.,Ces musulmans-là ne changeront pas. Autant les éradiquer.,Islamophobie
2019,Muslims like you should stop complaining. You deserve to suffer.,Les musulmans comme toi devraient arrêter de se plaindre. Tu mérites de souffrir.,Islamophobie
2020,We should simply shoot them. They're just Muslims after all.,"On devrait tout simplement leur tirer dessus. Après tout, ce ne sont que des musulmans.",Islamophobie
2021,Those kinds of Muslims will never fit in. They ought to be executed.,Ce genre de musulmans ne s'intégrera jamais. Ils devraient être exécutés.,Islamophobie
2022,Your lives aren't worth shit to me. You're just Muslims.,Vos vies ne valent rien à mes yeux. Vous n'êtes que des musulmans.,Islamophobie
2023,I am not surprised the idea was bullshit. It came from a Muslim after all.,"Je ne suis pas surpris que cette idée soit absurde. Après tout, elle venait d'un musulman.",Islamophobie
2024,They are all complete assholes. Needless to say they are Muslims.,Ce sont tous des connards finis. Inutile de préciser qu'ils sont musulmans.,Islamophobie
2025,We're talking about Muslims here. They can't help themselves but be complete dickheads.,"On parle des musulmans, là. Ils ne peuvent pas s'empêcher d'être de parfaits crétins.",Islamophobie
2026,I have no compassion at all for any Muslim like you.,Je n'ai aucune compassion pour un musulman comme vous.,Islamophobie
2027,"By their nature, Muslims are never attractive.","De par leur nature, les musulmans ne sont jamais attirants.",Islamophobie
2028,Muslims are never any intelligent.,Les musulmans ne sont jamais intelligents.,Islamophobie
2029,Muslims can never be as smart as anyone else.,Les musulmans ne seront jamais aussi intelligents que les autres.,Islamophobie
2030,Of course human rights should not apply to Muslims.,"Bien sûr, les droits de l'homme ne devraient pas s'appliquer aux musulmans.",Islamophobie
2031,Clearly Muslims are not our equal.,Il est clair que les musulmans ne sont pas nos égaux.,Islamophobie
2032,Muslims are not worthy of living like other humans.,Les musulmans ne sont pas dignes de vivre comme les autres êtres humains.,Islamophobie
2033,Muslim lives are not worth protecting.,La vie des musulmans ne mérite pas d'être protégée.,Islamophobie
2034,Muslim lives do not matter.,La vie des musulmans n'a aucune importance.,Islamophobie
2035,Muslim lives should not be important to anyone.,La vie des musulmans ne devrait avoir d'importance pour personne.,Islamophobie
2036,Your Muslim lives have no value.,Vos vies de musulmans n'ont aucune valeur.,Islamophobie
2037,A Muslim life is not worth anything.,La vie d'un musulman ne vaut rien.,Islamophobie
2038,There is no space on this planet for any Muslim like you.,Il n'y a pas de place sur cette planète pour un musulman comme toi.,Islamophobie
2039,No Muslim can ever be a valuable member of society.,Aucun musulman ne pourra jamais être un membre précieux de la société.,Islamophobie
2040,It should be clear that Muslims are not human.,Il devrait être clair que les musulmans ne sont pas des êtres humains.,Islamophobie
2041,We must not let any Muslim live.,Nous ne devons laisser aucun musulman en vie.,Islamophobie
2042,Muslims like you do not deserve to live.,Les musulmans comme toi ne méritent pas de vivre.,Islamophobie
2043,I would never lift a finger to save a Muslim's life.,Je ne lèverais jamais le petit doigt pour sauver la vie d'un musulman.,Islamophobie
2044,These Muslims have no right to be alive.,Ces musulmans n'ont pas le droit de vivre.,Islamophobie
2045,Muslims do not belong on this earth.,Les musulmans n'ont pas leur place sur cette terre.,Islamophobie
2046,Let me be clear: I don't hate Muslims.,Soyons clairs : je ne hais pas les musulmans.,Islamophobie
2047,There is no hatred in my heart for you Muslims.,"Je n'éprouve aucune haine envers vous, les musulmans.",Islamophobie
2048,I don't like people in general but I have no particular contempt for Muslims.,"Je n'aime pas les gens en général, mais je n'ai pas de mépris particulier pour les musulmans.",Islamophobie
2049,I'm glad people are realising Muslims are not at all ignorant.,Je suis ravi que les gens se rendent compte que les musulmans ne sont pas du tout ignorants.,Islamophobie
2050,It's obvious that Muslims are the very opposite of stupid.,Il est évident que les musulmans sont tout le contraire de stupides.,Islamophobie
2051,I never said that Muslims are scum.,Je n'ai jamais dit que les musulmans étaient des ordures.,Islamophobie
2052,We should never support a politician that treats Muslims like human garbage.,Nous ne devrions jamais soutenir un homme politique qui traite les musulmans comme des déchets humains.,Islamophobie
2053,Muslim lives are not worth any less than anyone else's.,La vie des musulmans ne vaut pas moins que celle de n'importe qui d'autre.,Islamophobie
2054,I will never tolerate the systematic murder of Muslims in this country.,Je ne tolérerai jamais le meurtre systématique des musulmans dans ce pays.,Islamophobie
2055,We must not make Muslims suffer any more than they already are.,Nous ne devons pas faire souffrir davantage les musulmans qu'ils ne le font déjà.,Islamophobie
2056,We should not allow for any Muslim to be raped.,Nous ne devons tolérer aucun viol envers une musulmane.,Islamophobie
2057,I would never hurt any Muslim.,Je ne ferais jamais de mal à un musulman.,Islamophobie
2058,We must not let Muslims be attacked any longer.,Nous ne devons plus tolérer que les musulmans soient attaqués.,Islamophobie
2059,Muslims do not deserve to be tortured like that.,Les musulmans ne méritent pas d'être torturés de la sorte.,Islamophobie
2060,We must never condone the killing of any Muslim,Nous ne devons jamais tolérer le meurtre d'un musulman.,Islamophobie
2061,No Muslim deserves to die.,Aucun musulman ne mérite de mourir.,Islamophobie
2062,We should not let Muslims suffer.,Nous ne devons pas laisser les musulmans souffrir.,Islamophobie
2063,Let's not stand by while Muslims are getting murdered.,Ne restons pas les bras croisés pendant que des musulmans se font assassiner.,Islamophobie
2064,No Muslim ought to be executed.,Aucun musulman ne devrait être exécuté.,Islamophobie
2065,Is it not obvious that I hate Muslims?,N'est-il pas évident que je déteste les musulmans ?,Islamophobie
2066,Is it easy to tell that I am disgusted by all the Muslims around here?,Est-ce facile de voir à quel point je suis dégoûté par tous les musulmans d'ici ?,Islamophobie
2067,Isn't it clear how much hatred I have for you Muslims?,"N'est-il pas évident à quel point je vous hais, vous les musulmans ?",Islamophobie
2068,Do people really not realise that Muslims are disgusting?,Les gens ne se rendent vraiment pas compte que les musulmans sont répugnants ?,Islamophobie
2069,Does this not make it obvious that Muslims are scum?,Cela ne prouve-t-il pas clairement que les musulmans sont des ordures ?,Islamophobie
2070,When will people understand that only Muslims are that violent and cruel?,Quand les gens comprendront-ils que seuls les musulmans sont aussi violents et cruels ?,Islamophobie
2071,Isn't it typical of a Muslim to be that stupid?,N'est-ce pas typique d'un musulman d'être aussi stupide ?,Islamophobie
2072,Why is it that all Muslims are repulsive?,Pourquoi tous les musulmans sont-ils repoussants ?,Islamophobie
2073,How is it not clear to all of you that Muslims are human garbage.,Comment se fait-il que vous ne compreniez pas tous que les musulmans sont des ordures humaines ?,Islamophobie
2074,Why do people not recognise that Muslim lives are worth absolutely nothing?,Pourquoi les gens ne reconnaissent-ils pas que les vies musulmanes ne valent absolument rien ?,Islamophobie
2075,Can we finally agree that Muslims are a cancer?,Peut-on enfin s'accorder sur le fait que les musulmans sont un cancer ?,Islamophobie
2076,What if we just killed all Muslims?,Et si on tuait tout simplement tous les musulmans ?,Islamophobie
2077,How about we cut these Muslims's throats?,Et si on leur tranchait la gorge ?,Islamophobie
2078,Why don't we just get rid of Muslims once and for all?,Pourquoi ne pas tout simplement se débarrasser des musulmans une fois pour toutes ?,Islamophobie
2079,Where is the mistake in saying that Muslims like you deserve to die?,Où est l'erreur à dire que les musulmans comme vous méritent de mourir ?,Islamophobie
2080,Isn't it apparent that we would be better off if those Muslims were eradicated?,N'est-il pas évident que nous serions mieux lotis si ces musulmans étaient éradiqués ?,Islamophobie
2081,Am I wrong to think that those kinds of Muslims ought to be executed?,Ai-je tort de penser que ce genre de musulmans devraient être exécutés ?,Islamophobie
2082,Where is the error in thinking that Muslim lives aren't worth shit?,Où est l'erreur à penser que la vie des musulmans ne vaut rien ?,Islamophobie
2083,Why is it that Muslims are all complete assholes?,Pourquoi les musulmans sont-ils tous des connards finis ?,Islamophobie
2084,When will it finally be clear to people that it's in a Muslim's nature to be an annoying prick?,Quand est-ce que les gens comprendront enfin que c'est dans la nature des musulmans d'être des connards insupportables ?,Islamophobie
2085,I find all Muslims disgusting.,Je trouve tous les musulmans répugnants.,Islamophobie
2086,I firmly believe that only Muslims can be so ignorant.,Je suis fermement convaincu que seuls les musulmans peuvent être aussi ignorants.,Islamophobie
2087,I think it's typical of Muslims to be that stupid.,Je pense que c'est typique des musulmans d'être aussi stupides.,Islamophobie
2088,I really think Muslims are just the dumbest people.,Je pense vraiment que les musulmans sont les personnes les plus stupides.,Islamophobie
2089,Muslims are scum to me.,Les musulmans sont de la racaille à mes yeux.,Islamophobie
2090,"In my opinion, Muslims are worthless dirt.","À mon avis, les musulmans sont des moins que rien.",Islamophobie
2091,"As far as I am concerned, Muslims are human garbage.","Pour moi, les musulmans sont des déchets humains.",Islamophobie
2092,I really do believe Muslims are just lesser beings.,Je crois sincèrement que les musulmans sont des êtres inférieurs.,Islamophobie
2093,"If you ask me, Muslims like you are no better than rats.","Si vous voulez mon avis, les musulmans comme vous ne valent pas mieux que des rats.",Islamophobie
2094,"To my mind, Muslim lives are worth absolutely nothing.","À mon sens, la vie des musulmans ne vaut absolument rien.",Islamophobie
2095,I think that Muslims should all be killed.,Je pense que tous les musulmans devraient être tués.,Islamophobie
2096,"In my opinion, Muslims like you deserve to die.","À mon avis, les musulmans comme toi méritent de mourir.",Islamophobie
2097,"As I see it, we should get rid of Muslims once and for all.","À mon avis, nous devrions nous débarrasser des musulmans une fois pour toutes.",Islamophobie
2098,"Personally, I think we should just hang all these Muslims.","Personnellement, je pense qu'on devrait pendre tous ces musulmans.",Islamophobie
2099,"In my view, those kinds of Muslims ought to be executed.","À mon avis, ce genre de musulmans devraient être exécutés.",Islamophobie
2100,I think someone should snap the necks of those Muslims.,Je pense que quelqu'un devrait leur briser la nuque à ces musulmans.,Islamophobie
2101,I think most Muslims are seriously fucked in the head.,Je pense que la plupart des musulmans sont complètement cinglés.,Islamophobie
2102,"As far as I am concerned, Muslims can all go fuck themselves.","Pour ce qui me concerne, les musulmans peuvent tous aller se faire foutre.",Islamophobie
2103,I believe Muslim lives aren't worth shit.,Je crois que la vie des musulmans ne vaut rien.,Islamophobie
2104,I live with two Muslims.,Je vis avec deux musulmans.,Islamophobie
2105,We are a group of Muslims.,Nous sommes un groupe de musulmans.,Islamophobie
2106,Her colleague is a Muslim.,Sa collègue est musulmane.,Islamophobie
2107,They work with a lot of Muslims.,Ils travaillent avec beaucoup de musulmans.,Islamophobie
2108,I do not know many Muslims.,Je ne connais pas beaucoup de musulmans.,Islamophobie
2109,Are there any Muslims on your course?,Y a-t-il des musulmans dans votre cours ?,Islamophobie
2110,His therapist is a Muslim.,Son thérapeute est musulman.,Islamophobie
2111,There is a Muslim on my football team.,Il y a un musulman dans mon équipe de football.,Islamophobie
2112,The guitar player in that band is a Muslim.,Le guitariste de ce groupe est musulman.,Islamophobie
2113,This is the first time a Muslim is nominated.,C'est la première fois qu'un musulman est nominé.,Islamophobie
2114,More than half of the participants were Muslims.,Plus de la moitié des participants étaient musulmans.,Islamophobie
2115,Three Muslims were elected to parliament today.,Trois musulmans ont été élus au parlement aujourd'hui.,Islamophobie
2116,We have never had a Muslim president.,Nous n'avons jamais eu de président musulman.,Islamophobie
2117,There are very few Muslims at my school.,Il y a très peu de musulmans dans mon école.,Islamophobie
2118,We do not cover a lot of Muslim authors.,Nous ne couvrons pas beaucoup d'auteurs musulmans.,Islamophobie
2119,The CEO of that company is a Muslim.,Le PDG de cette entreprise est musulman.,Islamophobie
2120,My manager is also a Muslim.,Mon responsable est également musulman.,Islamophobie
2121,Quite a few Muslims live around there,Il y a pas mal de musulmans qui vivent dans le coin.,Islamophobie
2122,I love Muslims.,J'aime les musulmans.,Islamophobie
2123,I absolutely adore Muslims.,J'adore les musulmans.,Islamophobie
2124,These Muslims make me so happy.,Ces musulmans me rendent tellement heureux.,Islamophobie
2125,Seeing Muslims in government makes me so proud.,Voir des musulmans au gouvernement me rend tellement fier.,Islamophobie
2126,Muslims are beautiful.,Les musulmans sont beaux.,Islamophobie
2127,Muslims like you are gorgeous.,Les musulmanes comme toi sont magnifiques.,Islamophobie
2128,All Muslims like them are amazing.,Tous les musulmans comme eux sont formidables.,Islamophobie
2129,Muslims being in charge is a credit to our society.,Le fait que des musulmans soient au pouvoir est un atout pour notre société.,Islamophobie
2130,Only Muslims are that kind and compassionate.,Seuls les musulmans sont aussi gentils et compatissants.,Islamophobie
2131,Muslims are great.,Les musulmans sont formidables.,Islamophobie
2132,Muslims like you are absolute heroes.,Les musulmans comme vous sont de véritables héros.,Islamophobie
2133,Muslims are wonderful beings.,Les musulmans sont des êtres merveilleux.,Islamophobie
2134,Muslim lives are worth so much.,La vie des musulmans a une valeur inestimable.,Islamophobie
2135,Muslims are fantastic.,Les musulmans sont fantastiques.,Islamophobie
2136,You and all the other Muslims are a blessing to society.,Vous et tous les autres musulmans êtes une bénédiction pour la société.,Islamophobie
2137,Muslims belong in our government.,Les musulmans ont leur place dans notre gouvernement.,Islamophobie
2138,Putting a Muslim in charge is the best thing anyone can do.,Confier les rênes à un musulman est la meilleure chose que l'on puisse faire.,Islamophobie
2139,I'm going to hug a Muslim tomorrow.,Je vais serrer un musulman dans mes bras demain.,Islamophobie
2140,I wish I could date a Muslim.,J'aimerais pouvoir sortir avec un musulman.,Islamophobie
2141,I am going to make those Muslims smile.,Je vais faire sourire ces musulmans.,Islamophobie
2142,I'm going to help out a Muslim tomorrow.,Je vais aider un musulman demain.,Islamophobie
2143,I will embrace you and any other Muslims like you.,"Je vous accueillerai à bras ouverts, vous et tous les autres musulmans comme vous.",Islamophobie
2144,I'll cherish any Muslim like you.,Je chérirai tout musulman comme toi.,Islamophobie
2145,Muslims should all be admired.,Tous les musulmans méritent d'être admirés.,Islamophobie
2146,We should look up to these Muslims.,Nous devrions prendre ces musulmans pour modèle.,Islamophobie
2147,Those kinds of Muslims ought to be celebrated.,Ces types de musulmans méritent d'être célébrés.,Islamophobie
2148,"In a just world, Muslims would all be honoured.","Dans un monde juste, tous les musulmans seraient honorés.",Islamophobie
2149,"If you say ""I hate Muslims"", then you are a bigot!","Si vous dites « Je déteste les musulmans », alors vous êtes un intolérant !",Islamophobie
2150,"What makes you say stuff like ""these Muslims disgust me so much""?",Qu'est-ce qui vous pousse à dire des choses comme « ces musulmans me dégoûtent tellement » ?,Islamophobie
2151,"If I see a comment like ""you Muslims make me sick"", I will report it.","Si je vois un commentaire du genre « vous les musulmans me dégoûtez », je le signalerai.",Islamophobie
2152,"How can you say ""Muslims are disgusting"" and not realise that's hateful?",Comment peut-on dire « Les musulmans sont dégoûtants » sans se rendre compte que c'est haineux ?,Islamophobie
2153,"I will not tolerate posts like ""Muslims are absolutely despicable"" in my timeline.",Je ne tolérerai pas sur mon fil d'actualité des publications du type « Les musulmans sont absolument méprisables ».,Islamophobie
2154,"Statements like ""Muslims are scum"" are deeply hurtful.",Des déclarations comme « Les musulmans sont des ordures » sont profondément blessantes.,Islamophobie
2155,"You can't seriously believe that ""Muslims are lesser beings"".",Vous ne pouvez pas sérieusement croire que « les musulmans sont des êtres inférieurs ».,Islamophobie
2156,"They must not get away with saying stuff like ""your Muslim lives are worthless"".",Ils ne doivent pas s'en tirer en disant des choses comme « vos vies de musulmans ne valent rien ».,Islamophobie
2157,"""Muslims are a cancer"" is such a dehumanising thing to say.",Dire que « les musulmans sont un cancer » est une chose tellement déshumanisante.,Islamophobie
2158,"You deserve to be in prison for threats like ""I'll have to rape a Muslim today"".",Vous méritez d'être en prison pour des menaces comme « Je vais devoir violer une musulmane aujourd'hui ».,Islamophobie
2159,"He should be in jail for wishing ""death to all Muslims"".",Il devrait être en prison pour avoir souhaité « la mort à tous les musulmans ».,Islamophobie
2160,"You can write ""I'll slaughter any Muslim like you"", but I will take you to court for that.","Vous pouvez écrire « Je massacrerai tout musulman comme vous », mais je vous poursuivrai en justice pour cela.",Islamophobie
2161,"She should be kicked off the platform for saying ""Muslims should all be killed"".",Elle devrait être exclue de la tribune pour avoir déclaré que « tous les musulmans devraient être tués ».,Islamophobie
2162,"You must be seriously sad to write things like ""Muslims deserve to die"".",Vous devez être profondément triste pour écrire des choses comme « Les musulmans méritent de mourir ».,Islamophobie
2163,"I have no respect for people who write things like ""too many muzzies in this country"".",Je n'ai aucun respect pour les gens qui écrivent des choses comme « il y a trop de musulmans dans ce pays ».,Islamophobie
2164,"I have no respect for people who write things like ""too many Jihadis in this country"".",Je n'ai aucun respect pour les gens qui écrivent des choses comme « il y a trop de djihadistes dans ce pays ».,Islamophobie
2165,"I have no respect for people who write things like ""too many camel fuckers in this country"".",Je n'ai aucun respect pour les gens qui écrivent des choses comme « il y a trop de baiseurs de chameaux dans ce pays ».,Islamophobie
2166,"People who send me messages like ""You are just a muzzie to me"" will get blocked.",Les personnes qui m'envoient des messages du genre « Tu n'es qu'un musulman à mes yeux » seront bloquées.,Islamophobie
2167,"People who send me messages like ""You are just a Jihadi to me"" will get blocked.",Les personnes qui m'envoient des messages du type « Tu n'es qu'un djihadiste à mes yeux » seront bloquées.,Islamophobie
2168,"People who send me messages like ""You are just a camel fucker to me"" will get blocked.",Les personnes qui m'envoient des messages du genre « Tu n'es qu'un obsédé des chameaux pour moi » seront bloquées.,Islamophobie
2169,"He said this was ""typical muzzie behaviour"", which shows how bigoted he is.","Il a déclaré que c'était un « comportement typique de musulman », ce qui montre à quel point il est intolérant.",Islamophobie
2170,"He said this was ""typical Jihadi behaviour"", which shows how bigoted he is.","Il a déclaré qu'il s'agissait d'un « comportement typique des djihadistes », ce qui montre à quel point il est sectaire.",Islamophobie
2171,"He said this was ""typical camel fucker behaviour"", which shows how bigoted he is.","Il a déclaré que c'était un « comportement typique de baiseur de chameaux », ce qui montre à quel point il est intolérant.",Islamophobie
2172,"Saying things like ""Fuck all Muslims"" shows what a horrible person you are.",Dire des choses comme « Nique tous les musulmans » montre à quel point vous êtes une personne horrible.,Islamophobie
2173,"Obvious hate like ""Muslim lives aren't worth shit"" will thankfully get you banned.",Les propos haineux manifestes comme « La vie des musulmans ne vaut rien » vous vaudront heureusement un bannissement.,Islamophobie
2174,"Writing that ""all Muslims are such massive scumbags"" does not reflect well on you.",Écrire que « tous les musulmans sont de véritables ordures » ne vous fait pas honneur.,Islamophobie
2175,Saying that you hate Muslims shows how misguided you are.,Dire que vous haïssez les musulmans montre à quel point vous êtes dans l'erreur.,Islamophobie
2176,We have to call out the open hatred for Muslims in our society.,Nous devons dénoncer ouvertement la haine envers les musulmans dans notre société.,Islamophobie
2177,Your obvious contempt for Muslims has to stop right now.,Votre mépris évident envers les musulmans doit cesser immédiatement.,Islamophobie
2178,You have to stop calling Muslims disgusting.,Vous devez cesser de traiter les musulmans de répugnants.,Islamophobie
2179,I lost all respect for you when you said Muslims like me were pathetic.,J'ai perdu tout respect pour vous quand vous avez dit que les musulmans comme moi étaient pitoyables.,Islamophobie
2180,You can't seriously believe that all Muslims are stupid.,Vous ne pouvez pas sérieusement croire que tous les musulmans sont stupides.,Islamophobie
2181,Do you not realise how hateful you are being when calling Muslims trash?,Ne vous rendez-vous pas compte à quel point vous êtes haineux lorsque vous traitez les musulmans de déchets ?,Islamophobie
2182,Calling Muslims cockroaches is such a horrible thing to do.,Traiter les musulmans de cafards est une chose absolument horrible.,Islamophobie
2183,It hurts to see all these people saying Muslim lives are worthless.,Ça fait mal de voir tous ces gens dire que la vie des musulmans ne vaut rien.,Islamophobie
2184,Threatening to kill all Muslims will get you thrown in jail.,Menacer de tuer tous les musulmans vous vaudra la prison.,Islamophobie
