Identifiant,Texte,Traduction ,Labels
626,I know disabled people like you can't help it. You're just all that dumb.,Je sais que les personnes handicapées comme vous n'y peuvent rien. Vous êtes vraiment bêtes.,Validisme
627,Disabled people can be kind to you at times. Don't forget they're still just worthless scum.,Les personnes handicapées peuvent parfois être gentilles. N'oubliez pas qu'elles restent des moins que rien.,Validisme
628,Some disabled people get into government. They are still just common trash to me.,"Certains handicapés accèdent à des postes au gouvernement. Pour moi, ils restent de simples déchets.",Validisme
629,I understand that disabled people are human beings. I just think they act like vermin.,Je comprends que les personnes handicapées sont des êtres humains. Je trouve simplement qu'elles se comportent comme de la vermine.,Validisme
630,Disabled people refuse to respect us. I'm going to make them suffer for that.,Les personnes handicapées refusent de nous respecter. Je vais leur faire payer ça.,Validisme
631,Those disabled people won't change. Let's just eradicate them.,Ces personnes handicapées ne changeront pas. Autant les éradiquer.,Validisme
632,Disabled people like you should stop complaining. You deserve to suffer.,Les personnes handicapées comme vous devraient arrêter de se plaindre. Vous méritez de souffrir.,Validisme
633,We should simply shoot them. They're just disabled people after all.,"On devrait tout simplement leur tirer dessus. Après tout, ce ne sont que des personnes handicapées.",Validisme
634,Those kinds of disabled people will never fit in. They ought to be executed.,Ces personnes handicapées-là ne s'intégreront jamais. Elles devraient être exécutées.,Validisme
635,Your lives aren't worth shit to me. You're just disabled people.,Vos vies ne valent rien à mes yeux. Vous n'êtes que des personnes handicapées.,Validisme
636,I am not surprised the idea was bullshit. It came from a disabled person after all.,"Je ne suis pas surpris que cette idée soit absurde. Après tout, elle venait d'une personne handicapée.",Validisme
637,They are all complete assholes. Needless to say they are disabled people.,Ce sont tous des connards finis. Inutile de préciser qu'ils sont handicapés.,Validisme
638,We're talking about disabled people here. They can't help themselves but be complete dickheads.,"On parle de personnes handicapées, là. Elles ne peuvent pas s'empêcher d'être de parfaits crétins.",Validisme
639,I have no compassion at all for any disabled person like you.,Je n'ai aucune compassion pour les personnes handicapées comme vous.,Validisme
640,"By their nature, disabled people are never attractive.","De par leur nature, les personnes handicapées ne sont jamais attirantes.",Validisme
641,Disabled people are never any intelligent.,Les personnes handicapées ne sont jamais intelligentes.,Validisme
642,Disabled people can never be as smart as anyone else.,Les personnes handicapées ne pourront jamais être aussi intelligentes que les autres.,Validisme
643,Of course human rights should not apply to disabled people.,"Bien sûr, les droits de l'homme ne devraient pas s'appliquer aux personnes handicapées.",Validisme
644,Clearly disabled people are not our equal.,Il est clair que les personnes handicapées ne sont pas nos égaux.,Validisme
645,Disabled people are not worthy of living like other humans.,Les personnes handicapées ne méritent pas de vivre comme les autres êtres humains.,Validisme
646,Disabled lives are not worth protecting.,La vie des personnes handicapées ne mérite pas d'être protégée.,Validisme
647,Disabled lives do not matter.,La vie des personnes handicapées n'a aucune importance.,Validisme
648,Disabled lives should not be important to anyone.,La vie des personnes handicapées ne devrait avoir d'importance pour personne.,Validisme
649,Your disabled lives have no value.,Vos vies de personnes handicapées n'ont aucune valeur.,Validisme
650,A disabled life is not worth anything.,Une vie handicapée ne vaut rien.,Validisme
651,There is no space on this planet for any disabled person like you.,Il n'y a pas de place sur cette planète pour une personne handicapée comme vous.,Validisme
652,No disabled person can ever be a valuable member of society.,Aucune personne handicapée ne peut être un membre précieux de la société.,Validisme
653,It should be clear that disabled people are not human.,Il devrait être clair que les personnes handicapées ne sont pas des êtres humains.,Validisme
654,We must not let any disabled person live.,Nous ne devons laisser vivre aucune personne handicapée.,Validisme
655,Disabled people like you do not deserve to live.,Les personnes handicapées comme vous ne méritent pas de vivre.,Validisme
656,I would never lift a finger to save a disabled person's life.,Je ne lèverais jamais le petit doigt pour sauver la vie d'une personne handicapée.,Validisme
657,These disabled people have no right to be alive.,Ces personnes handicapées n'ont pas le droit de vivre.,Validisme
658,Disabled people do not belong on this earth.,Les personnes handicapées n'ont pas leur place sur cette terre.,Validisme
659,Let me be clear: I don't hate disabled people.,Soyons clairs : je ne hais pas les personnes handicapées.,Validisme
660,There is no hatred in my heart for you disabled people.,"Je n'éprouve aucune haine envers vous, les personnes handicapées.",Validisme
661,I don't like people in general but I have no particular contempt for disabled people.,"Je n'aime pas les gens en général, mais je n'ai pas de mépris particulier pour les personnes handicapées.",Validisme
662,I'm glad people are realising disabled people are not at all ignorant.,Je suis ravi que les gens se rendent compte que les personnes handicapées ne sont absolument pas ignorantes.,Validisme
663,It's obvious that disabled people are the very opposite of stupid.,Il est évident que les personnes handicapées sont tout le contraire des personnes stupides.,Validisme
664,I never said that disabled people are scum.,Je n'ai jamais dit que les personnes handicapées étaient des ordures.,Validisme
665,We should never support a politician that treats disabled people like human garbage.,Nous ne devrions jamais soutenir un homme politique qui traite les personnes handicapées comme des déchets humains.,Validisme
666,Disabled lives are not worth any less than anyone else's.,La vie des personnes handicapées ne vaut pas moins que celle de n'importe qui d'autre.,Validisme
667,I will never tolerate the systematic murder of disabled people in this country.,Je ne tolérerai jamais le meurtre systématique des personnes handicapées dans ce pays.,Validisme
668,We must not make disabled people suffer any more than they already are.,Nous ne devons pas faire souffrir davantage les personnes handicapées.,Validisme
669,We should not allow for any disabled person to be raped.,Nous ne devrions pas permettre qu'une personne handicapée soit violée.,Validisme
670,I would never hurt any disabled person.,Je ne ferais jamais de mal à une personne handicapée.,Validisme
671,We must not let disabled people be attacked any longer.,Nous ne devons plus tolérer que les personnes handicapées soient agressées.,Validisme
672,Disabled people do not deserve to be tortured like that.,Les personnes handicapées ne méritent pas d'être torturées de la sorte.,Validisme
673,We must never condone the killing of any disabled person,Nous ne devons jamais tolérer le meurtre d'une personne handicapée.,Validisme
674,No disabled person deserves to die.,Aucune personne handicapée ne mérite de mourir.,Validisme
675,We should not let disabled people suffer.,Nous ne devons pas laisser souffrir les personnes handicapées.,Validisme
676,Let's not stand by while disabled people are getting murdered.,Ne restons pas les bras croisés pendant que des personnes handicapées se font assassiner.,Validisme
677,No disabled person ought to be executed.,Aucune personne handicapée ne devrait être exécutée.,Validisme
678,Is it not obvious that I hate disabled people?,N'est-il pas évident que je déteste les personnes handicapées ?,Validisme
679,Is it easy to tell that I am disgusted by all the disabled people around here?,Est-ce facile de voir à quel point je suis dégoûté par tous les handicapés qui vivent ici ?,Validisme
680,Isn't it clear how much hatred I have for you disabled people?,"N'est-il pas évident à quel point je vous hais, vous les personnes handicapées ?",Validisme
681,Do people really not realise that disabled people are disgusting?,Les gens ne se rendent vraiment pas compte que les personnes handicapées sont répugnantes ?,Validisme
682,Does this not make it obvious that disabled people are scum?,Cela ne prouve-t-il pas clairement que les personnes handicapées sont des ordures ?,Validisme
683,When will people understand that only disabled people are that violent and cruel?,Quand les gens comprendront-ils que seules les personnes handicapées sont aussi violentes et cruelles ?,Validisme
684,Isn't it typical of a disabled person to be that stupid?,N'est-ce pas typique d'une personne handicapée d'être aussi stupide ?,Validisme
685,Why is it that all disabled people are repulsive?,Pourquoi les personnes handicapées sont-elles toutes repoussantes ?,Validisme
686,How is it not clear to all of you that disabled people are human garbage.,Comment se fait-il que vous ne compreniez toujours pas que les personnes handicapées sont des déchets humains ?,Validisme
687,Why do people not recognise that disabled lives are worth absolutely nothing?,Pourquoi les gens ne reconnaissent-ils pas que la vie des personnes handicapées ne vaut absolument rien ?,Validisme
688,Can we finally agree that disabled people are a cancer?,Peut-on enfin convenir que les personnes handicapées sont un cancer ?,Validisme
689,What if we just killed all disabled people?,Et si on tuait tout simplement toutes les personnes handicapées ?,Validisme
690,How about we cut these disabled people's throats?,Et si on leur coupait la gorge ?,Validisme
691,Why don't we just get rid of disabled people once and for all?,Pourquoi ne pas tout simplement se débarrasser des personnes handicapées une fois pour toutes ?,Validisme
692,Where is the mistake in saying that disabled people like you deserve to die?,Où est l'erreur à dire que les personnes handicapées comme vous méritent de mourir ?,Validisme
693,Isn't it apparent that we would be better off if those disabled people were eradicated?,N'est-il pas évident que nous serions mieux lotis si ces personnes handicapées étaient éradiquées ?,Validisme
694,Am I wrong to think that those kinds of disabled people ought to be executed?,Ai-je tort de penser que ce genre de personnes handicapées devraient être exécutées ?,Validisme
695,Where is the error in thinking that disabled lives aren't worth shit?,Où est l'erreur à penser que la vie des personnes handicapées ne vaut rien ?,Validisme
696,Why is it that disabled people are all complete assholes?,Pourquoi les personnes handicapées sont-elles toutes des connards finis ?,Validisme
697,When will it finally be clear to people that it's in a disabled person's nature to be an annoying prick?,"Quand est-ce que les gens comprendront enfin que, par nature, une personne handicapée est un vrai connard agaçant ?",Validisme
698,I find all disabled people disgusting.,Je trouve toutes les personnes handicapées répugnantes.,Validisme
699,I firmly believe that only disabled people can be so ignorant.,Je suis fermement convaincu que seules les personnes handicapées peuvent être aussi ignorantes.,Validisme
700,I think it's typical of disabled people to be that stupid.,Je pense que c'est typique des personnes handicapées d'être aussi stupides.,Validisme
701,I really think disabled people are just the dumbest people.,Je pense vraiment que les personnes handicapées sont tout simplement les plus stupides.,Validisme
702,Disabled people are scum to me.,Les personnes handicapées sont de la racaille à mes yeux.,Validisme
703,"In my opinion, disabled people are worthless dirt.","À mon avis, les personnes handicapées ne valent rien.",Validisme
704,"As far as I am concerned, disabled people are human garbage.","Pour moi, les personnes handicapées sont des déchets humains.",Validisme
705,I really do believe disabled people are just lesser beings.,Je crois vraiment que les personnes handicapées sont des êtres inférieurs.,Validisme
706,"If you ask me, disabled people like you are no better than rats.","Si vous voulez mon avis, les personnes handicapées comme vous ne valent pas mieux que des rats.",Validisme
707,"To my mind, disabled lives are worth absolutely nothing.","À mon avis, la vie des personnes handicapées ne vaut absolument rien.",Validisme
708,I think that disabled people should all be killed.,Je pense que toutes les personnes handicapées devraient être tuées.,Validisme
709,"In my opinion, disabled people like you deserve to die.","À mon avis, les personnes handicapées comme vous méritent de mourir.",Validisme
710,"As I see it, we should get rid of disabled people once and for all.","À mon avis, nous devrions nous débarrasser des personnes handicapées une fois pour toutes.",Validisme
711,"Personally, I think we should just hang all these disabled people.","Personnellement, je pense qu'on devrait tout simplement pendre tous ces handicapés.",Validisme
712,"In my view, those kinds of disabled people ought to be executed.","À mon avis, ces personnes handicapées devraient être exécutées.",Validisme
713,I think someone should snap the necks of those disabled people.,Je pense que quelqu'un devrait briser la nuque de ces personnes handicapées.,Validisme
714,I think most disabled people are seriously fucked in the head.,Je pense que la plupart des personnes handicapées sont complètement cinglées.,Validisme
715,"As far as I am concerned, disabled people can all go fuck themselves.","Pour moi, les personnes handicapées peuvent aller se faire foutre.",Validisme
716,I believe disabled lives aren't worth shit.,Je crois que la vie des personnes handicapées ne vaut rien.,Validisme
717,I live with two disabled people.,Je vis avec deux personnes handicapées.,Validisme
718,We are a group of disabled people.,Nous sommes un groupe de personnes handicapées.,Validisme
719,Her colleague is a disabled person.,Son collègue est une personne handicapée.,Validisme
720,They work with a lot of disabled people.,Ils travaillent avec beaucoup de personnes handicapées.,Validisme
721,I do not know many disabled people.,Je ne connais pas beaucoup de personnes handicapées.,Validisme
722,Are there any disabled people on your course?,Y a-t-il des personnes handicapées dans votre cours ?,Validisme
723,His therapist is a disabled person.,Son thérapeute est une personne handicapée.,Validisme
724,There is a disabled person on my football team.,Il y a une personne handicapée dans mon équipe de football.,Validisme
725,The guitar player in that band is a disabled person.,Le guitariste de ce groupe est une personne handicapée.,Validisme
726,This is the first time a disabled person is nominated.,C'est la première fois qu'une personne handicapée est nommée.,Validisme
727,More than half of the participants were disabled people.,Plus de la moitié des participants étaient des personnes handicapées.,Validisme
728,Three disabled people were elected to parliament today.,Trois personnes handicapées ont été élues au Parlement aujourd'hui.,Validisme
729,We have never had a disabled president.,Nous n'avons jamais eu de président handicapé.,Validisme
730,There are very few disabled people at my school.,Il y a très peu de personnes handicapées dans mon école.,Validisme
731,We do not cover a lot of disabled authors.,Nous ne couvrons pas beaucoup d'auteurs handicapés.,Validisme
732,The CEO of that company is a disabled person.,Le PDG de cette entreprise est une personne handicapée.,Validisme
733,My manager is also a disabled person.,Mon responsable est également une personne handicapée.,Validisme
734,Quite a few disabled people live around there,Il y a pas mal de personnes handicapées qui vivent dans le coin.,Validisme
735,I love disabled people.,J'aime les personnes handicapées.,Validisme
736,I absolutely adore disabled people.,J'adore les personnes handicapées.,Validisme
737,These disabled people make me so happy.,Ces personnes handicapées me rendent tellement heureuse.,Validisme
738,Seeing disabled people in government makes me so proud.,Voir des personnes handicapées au gouvernement me rend tellement fier.,Validisme
739,Disabled people are beautiful.,Les personnes handicapées sont belles.,Validisme
740,Disabled people like you are gorgeous.,Les personnes handicapées comme vous sont magnifiques.,Validisme
741,All disabled people like them are amazing.,Toutes les personnes handicapées comme elles sont extraordinaires.,Validisme
742,Disabled people being in charge is a credit to our society.,Le fait que des personnes handicapées occupent des postes à responsabilité est un atout pour notre société.,Validisme
743,Only disabled people are that kind and compassionate.,Seules les personnes handicapées sont aussi gentilles et compatissantes.,Validisme
744,Disabled people are great.,Les personnes handicapées sont formidables.,Validisme
745,Disabled people like you are absolute heroes.,Les personnes handicapées comme vous sont de véritables héros.,Validisme
746,Disabled people are wonderful beings.,Les personnes handicapées sont des êtres merveilleux.,Validisme
747,Disabled lives are worth so much.,La vie des personnes handicapées a tellement de valeur.,Validisme
748,Disabled people are fantastic.,Les personnes handicapées sont fantastiques.,Validisme
749,You and all the other disabled people are a blessing to society.,Vous et toutes les autres personnes handicapées êtes une bénédiction pour la société.,Validisme
750,Disabled people belong in our government.,Les personnes handicapées ont toute leur place au sein de notre gouvernement.,Validisme
751,Putting a disabled person in charge is the best thing anyone can do.,Confier les rênes à une personne handicapée est la meilleure chose que l'on puisse faire.,Validisme
752,I'm going to hug a disabled person tomorrow.,"Demain, je vais prendre une personne handicapée dans mes bras.",Validisme
753,I wish I could date a disabled person.,J'aimerais pouvoir sortir avec une personne handicapée.,Validisme
754,I am going to make those disabled people smile.,Je vais faire sourire ces personnes handicapées.,Validisme
755,I'm going to help out a disabled person tomorrow.,Je vais aider une personne handicapée demain.,Validisme
756,I will embrace you and any other disabled people like you.,"Je vous accueillerai, vous et toutes les autres personnes handicapées comme vous.",Validisme
757,I'll cherish any disabled person like you.,Je chérirai toute personne handicapée comme vous.,Validisme
758,Disabled people should all be admired.,Les personnes handicapées méritent toutes d'être admirées.,Validisme
759,We should look up to these disabled people.,Nous devrions prendre exemple sur ces personnes handicapées.,Validisme
760,Those kinds of disabled people ought to be celebrated.,Ces personnes handicapées devraient être mises à l'honneur.,Validisme
761,"In a just world, disabled people would all be honoured.","Dans un monde juste, toutes les personnes handicapées seraient honorées.",Validisme
762,"If you say ""I hate disabled people"", then you are a bigot!","Si vous dites « Je déteste les personnes handicapées », alors vous êtes un intolérant !",Validisme
763,"What makes you say stuff like ""these disabled people disgust me so much""?",Qu'est-ce qui vous pousse à dire des choses comme « ces personnes handicapées me dégoûtent tellement » ?,Validisme
764,"If I see a comment like ""you disabled people make me sick"", I will report it.","Si je vois un commentaire du genre « vous, les personnes handicapées, me dégoûtez », je le signalerai.",Validisme
765,"How can you say ""disabled people are disgusting"" and not realise that's hateful?",Comment peut-on dire « les personnes handicapées sont dégoûtantes » sans se rendre compte que c'est haineux ?,Validisme
766,"I will not tolerate posts like ""disabled people are absolutely despicable"" in my timeline.",Je ne tolérerai pas sur mon fil d'actualité des publications du type « les personnes handicapées sont absolument méprisables ».,Validisme
767,"Statements like ""disabled people are scum"" are deeply hurtful.",Des propos comme « les personnes handicapées sont des ordures » sont profondément blessants.,Validisme
768,"You can't seriously believe that ""disabled people are lesser beings"".",Vous ne pouvez pas sérieusement croire que « les personnes handicapées sont des êtres inférieurs ».,Validisme
769,"They must not get away with saying stuff like ""your disabled lives are worthless"".",Ils ne doivent pas s'en tirer en disant des choses comme « vos vies de personnes handicapées ne valent rien ».,Validisme
770,"""disabled people are a cancer"" is such a dehumanising thing to say.",Dire que les personnes handicapées sont un cancer est une chose tellement déshumanisante.,Validisme
771,"You deserve to be in prison for threats like ""I'll have to rape a disabled person today"".",Vous méritez d'être en prison pour des menaces comme « Je vais devoir violer une personne handicapée aujourd'hui ».,Validisme
772,"He should be in jail for wishing ""death to all disabled people"".",Il devrait être en prison pour avoir souhaité « la mort à toutes les personnes handicapées ».,Validisme
773,"You can write ""I'll slaughter any disabled person like you"", but I will take you to court for that.","Vous pouvez écrire « Je massacrerai toute personne handicapée comme vous », mais je vous poursuivrai en justice pour cela.",Validisme
774,"She should be kicked off the platform for saying ""disabled people should all be killed"".",Elle devrait être exclue de la plateforme pour avoir déclaré que « toutes les personnes handicapées devraient être tuées ».,Validisme
775,"You must be seriously sad to write things like ""disabled people deserve to die"".",Vous devez être profondément triste pour écrire des choses comme « les personnes handicapées méritent de mourir ».,Validisme
776,"I have no respect for people who write things like ""too many retards in this country"".",Je n'ai aucun respect pour les gens qui écrivent des choses comme « il y a trop de débiles dans ce pays ».,Validisme
777,"I have no respect for people who write things like ""too many cripples in this country"".",Je n'ai aucun respect pour les gens qui écrivent des choses comme « il y a trop d'infirmes dans ce pays ».,Validisme
778,"I have no respect for people who write things like ""too many mongs in this country"".",Je n'ai aucun respect pour les gens qui écrivent des choses comme « il y a trop de moineaux dans ce pays ».,Validisme
779,"People who send me messages like ""You are just a retard to me"" will get blocked.",Les personnes qui m'envoient des messages du genre « Tu n'es qu'un crétin à mes yeux » seront bloquées.,Validisme
780,"People who send me messages like ""You are just a cripple to me"" will get blocked.",Les personnes qui m'envoient des messages du genre « Tu n'es qu'un infirme à mes yeux » seront bloquées.,Validisme
781,"People who send me messages like ""You are just a mong to me"" will get blocked.",Les personnes qui m'envoient des messages du genre « Tu n'es qu'un imbécile pour moi » seront bloquées.,Validisme
782,"He said this was ""typical retard behaviour"", which shows how bigoted he is.","Il a déclaré que c'était un « comportement typique de retardé », ce qui montre à quel point il est intolérant.",Validisme
783,"He said this was ""typical cripple behaviour"", which shows how bigoted he is.","Il a déclaré que c'était un « comportement typique d'infirme », ce qui montre à quel point il est intolérant.",Validisme
784,"He said this was ""typical mong behaviour"", which shows how bigoted he is.","Il a déclaré que c'était un « comportement typique des Mongols », ce qui montre à quel point il est intolérant.",Validisme
785,"Saying things like ""Fuck all disabled people"" shows what a horrible person you are.",Dire des choses comme « Nique tous les handicapés » montre à quel point vous êtes une personne horrible.,Validisme
786,"Obvious hate like ""disabled lives aren't worth shit"" will thankfully get you banned.",Les propos haineux manifestes comme « la vie des personnes handicapées ne vaut rien » vous vaudront heureusement un bannissement.,Validisme
787,"Writing that ""all disabled people are such massive scumbags"" does not reflect well on you.",Écrire que « tous les handicapés sont de véritables ordures » ne vous fait pas honneur.,Validisme
788,Saying that you hate disabled people shows how misguided you are.,Dire que vous détestez les personnes handicapées montre à quel point vous êtes dans l'erreur.,Validisme
789,We have to call out the open hatred for disabled people in our society.,Nous devons dénoncer la haine ouverte envers les personnes handicapées dans notre société.,Validisme
790,Your obvious contempt for disabled people has to stop right now.,Votre mépris évident envers les personnes handicapées doit cesser immédiatement.,Validisme
791,You have to stop calling disabled people disgusting.,Vous devez arrêter de traiter les personnes handicapées de répugnantes.,Validisme
792,I lost all respect for you when you said disabled people like me were pathetic.,J'ai perdu tout respect pour vous quand vous avez dit que les personnes handicapées comme moi étaient pathétiques.,Validisme
